{
  "$schema": "https://json-schema.org/draft/2020-12/schema",
  "$id": "urn:glomancy:conformance:task-verification-profile:1.0.0",
  "title": "Glomancy Task Verification Profile",
  "description": "Non-wire conformance policy describing structural verification requirements for one public task session.",
  "type": "object",
  "required": [
    "profile_version",
    "require_success",
    "require_context_snapshot_match",
    "require_read_back_verified",
    "required_evidence_types"
  ],
  "properties": {
    "profile_version": { "const": "1.0.0" },
    "require_success": { "type": "boolean" },
    "require_context_snapshot_match": { "type": "boolean" },
    "require_read_back_verified": { "type": "boolean" },
    "required_evidence_types": {
      "type": "array",
      "maxItems": 8,
      "uniqueItems": true,
      "items": {
        "$ref": "urn:glomancy:protocol:evidence.record:1.0.0#/allOf/1/properties/payload/properties/evidence_type"
      }
    },
    "evidence_coverage": {
      "type": "object",
      "description": "Optional fail-closed structural coverage requirements over public evidence records and terminal evidence_ids references.",
      "properties": {
        "minimum_terminal_referenced_evidence_count": {
          "type": "integer",
          "minimum": 0,
          "maximum": 256
        },
        "minimum_terminal_referenced_evidence_type_counts": {
          "type": "object",
          "maxProperties": 8,
          "propertyNames": {
            "enum": ["log", "screenshot", "asset-registry", "read-back", "build", "test", "diff", "rollback"]
          },
          "additionalProperties": {
            "type": "integer",
            "minimum": 1,
            "maximum": 256
          }
        },
        "maximum_unreferenced_evidence_count": {
          "type": "integer",
          "minimum": 0,
          "maximum": 256
        }
      },
      "additionalProperties": false
    },
    "terminal_outcome_policy": {
      "type": "object",
      "description": "Optional structural policy for accepted terminal statuses, status-specific terminal-linked evidence, and reported rollback attempts.",
      "properties": {
        "allowed_statuses": {
          "type": "array",
          "minItems": 1,
          "maxItems": 4,
          "uniqueItems": true,
          "items": {
            "enum": ["succeeded", "failed", "cancelled", "rolled_back"]
          }
        },
        "required_evidence_types_by_status": {
          "type": "object",
          "maxProperties": 4,
          "propertyNames": {
            "enum": ["succeeded", "failed", "cancelled", "rolled_back"]
          },
          "additionalProperties": {
            "type": "array",
            "maxItems": 8,
            "uniqueItems": true,
            "items": {
              "$ref": "urn:glomancy:protocol:evidence.record:1.0.0#/allOf/1/properties/payload/properties/evidence_type"
            }
          }
        },
        "require_rollback_attempted_for_statuses": {
          "type": "array",
          "maxItems": 3,
          "uniqueItems": true,
          "items": {
            "enum": ["failed", "cancelled", "rolled_back"]
          }
        }
      },
      "additionalProperties": false
    },
    "evidence_sequence": {
      "type": "object",
      "description": "Optional ordered-subsequence requirement over terminal-linked evidence records in transcript order.",
      "properties": {
        "required_terminal_evidence_sequence": {
          "type": "array",
          "minItems": 1,
          "maxItems": 16,
          "items": {
            "$ref": "urn:glomancy:protocol:evidence.record:1.0.0#/allOf/1/properties/payload/properties/evidence_type"
          }
        }
      },
      "additionalProperties": false
    }
  },
  "additionalProperties": false
}
